{
  "$schema": "https://yen-gov.github.io/schemas/constituency.schema.json",
  "$schema_version": "4.1",
  "sources": [
    {
      "url": "https://en.wikipedia.org/wiki/List_of_constituencies_of_the_Tamil_Nadu_Legislative_Assembly",
      "fetched_at": "2026-05-09T07:07:31Z"
    },
    {
      "url": "https://en.wikipedia.org/wiki/Tindivanam_Assembly_constituency",
      "fetched_at": "2026-05-09T14:19:09Z"
    }
  ],
  "state": "S22",
  "body": "AC",
  "status": "provisional",
  "constituencies": [
    {
      "eci_no": 1,
      "name": "Gummidipoondi",
      "district_id": "TAL",
      "reservation": "GEN"
    },
    {
      "eci_no": 2,
      "name": "Ponneri",
      "district_id": "TAL",
      "reservation": "SC"
    },
    {
      "eci_no": 3,
      "name": "Tiruttani",
      "district_id": "TAL",
      "reservation": "GEN"
    },
    {
      "eci_no": 4,
      "name": "Thiruvallur",
      "district_id": "TAL",
      "reservation": "GEN"
    },
    {
      "eci_no": 5,
      "name": "Poonamallee",
      "district_id": "TAL",
      "reservation": "SC"
    },
    {
      "eci_no": 6,
      "name": "Avadi",
      "district_id": "TAL",
      "reservation": "GEN"
    },
    {
      "eci_no": 7,
      "name": "Maduravoyal",
      "district_id": "CHN",
      "reservation": "GEN"
    },
    {
      "eci_no": 8,
      "name": "Ambattur",
      "district_id": "CHN",
      "reservation": "GEN"
    },
    {
      "eci_no": 9,
      "name": "Madavaram",
      "district_id": "CHN",
      "reservation": "GEN"
    },
    {
      "eci_no": 10,
      "name": "Thiruvottiyur",
      "district_id": "CHN",
      "reservation": "GEN"
    },
    {
      "eci_no": 11,
      "name": "Dr. Radhakrishnan Nagar",
      "district_id": "CHN",
      "reservation": "GEN"
    },
    {
      "eci_no": 12,
      "name": "Perambur",
      "district_id": "CHN",
      "reservation": "GEN"
    },
    {
      "eci_no": 13,
      "name": "Kolathur",
      "district_id": "CHN",
      "reservation": "GEN"
    },
    {
      "eci_no": 14,
      "name": "Villivakkam",
      "district_id": "CHN",
      "reservation": "GEN"
    },
    {
      "eci_no": 15,
      "name": "Thiru-Vi-Ka-Nagar",
      "district_id": "CHN",
      "reservation": "SC"
    },
    {
      "eci_no": 16,
      "name": "Egmore",
      "district_id": "CHN",
      "reservation": "SC"
    },
    {
      "eci_no": 17,
      "name": "Royapuram",
      "district_id": "CHN",
      "reservation": "GEN"
    },
    {
      "eci_no": 18,
      "name": "Harbour",
      "district_id": "CHN",
      "reservation": "GEN"
    },
    {
      "eci_no": 19,
      "name": "Chepauk-Thiruvallikeni",
      "district_id": "CHN",
      "reservation": "GEN"
    },
    {
      "eci_no": 20,
      "name": "Thousand Lights",
      "district_id": "CHN",
      "reservation": "GEN"
    },
    {
      "eci_no": 21,
      "name": "Anna Nagar",
      "district_id": "CHN",
      "reservation": "GEN"
    },
    {
      "eci_no": 22,
      "name": "Virugampakkam",
      "district_id": "CHN",
      "reservation": "GEN"
    },
    {
      "eci_no": 23,
      "name": "Saidapet",
      "district_id": "CHN",
      "reservation": "GEN"
    },
    {
      "eci_no": 24,
      "name": "Thiyagarayanagar",
      "district_id": "CHN",
      "reservation": "GEN"
    },
    {
      "eci_no": 25,
      "name": "Mylapore",
      "district_id": "CHN",
      "reservation": "GEN"
    },
    {
      "eci_no": 26,
      "name": "Velachery",
      "district_id": "CHN",
      "reservation": "GEN"
    },
    {
      "eci_no": 27,
      "name": "Sholinganallur",
      "district_id": "CHN",
      "reservation": "GEN"
    },
    {
      "eci_no": 28,
      "name": "Alandur",
      "district_id": "CHN",
      "reservation": "GEN"
    },
    {
      "eci_no": 29,
      "name": "Sriperumbudur",
      "district_id": "KAC",
      "reservation": "SC"
    },
    {
      "eci_no": 30,
      "name": "Pallavaram",
      "district_id": "CHG",
      "reservation": "GEN"
    },
    {
      "eci_no": 31,
      "name": "Tambaram",
      "district_id": "CHG",
      "reservation": "GEN"
    },
    {
      "eci_no": 32,
      "name": "Chengalpattu",
      "district_id": "CHG",
      "reservation": "GEN"
    },
    {
      "eci_no": 33,
      "name": "Thiruporur",
      "district_id": "CHG",
      "reservation": "GEN"
    },
    {
      "eci_no": 34,
      "name": "Cheyyur",
      "district_id": "CHG",
      "reservation": "SC"
    },
    {
      "eci_no": 35,
      "name": "Madurantakam",
      "district_id": "CHG",
      "reservation": "SC"
    },
    {
      "eci_no": 36,
      "name": "Uthiramerur",
      "district_id": "KAC",
      "reservation": "GEN"
    },
    {
      "eci_no": 37,
      "name": "Kancheepuram",
      "district_id": "KAC",
      "reservation": "GEN"
    },
    {
      "eci_no": 38,
      "name": "Arakkonam",
      "district_id": "RAN",
      "reservation": "SC"
    },
    {
      "eci_no": 39,
      "name": "Sholingur",
      "district_id": "RAN",
      "reservation": "GEN"
    },
    {
      "eci_no": 40,
      "name": "Katpadi",
      "district_id": "VEL",
      "reservation": "GEN"
    },
    {
      "eci_no": 41,
      "name": "Ranipet",
      "district_id": "RAN",
      "reservation": "GEN"
    },
    {
      "eci_no": 42,
      "name": "Arcot",
      "district_id": "RAN",
      "reservation": "GEN"
    },
    {
      "eci_no": 43,
      "name": "Vellore",
      "district_id": "VEL",
      "reservation": "GEN"
    },
    {
      "eci_no": 44,
      "name": "Anaikattu",
      "district_id": "VEL",
      "reservation": "GEN"
    },
    {
      "eci_no": 45,
      "name": "Kilvaithinankuppam",
      "district_id": "VEL",
      "reservation": "SC"
    },
    {
      "eci_no": 46,
      "name": "Gudiyatham",
      "district_id": "VEL",
      "reservation": "SC"
    },
    {
      "eci_no": 47,
      "name": "Vaniyambadi",
      "district_id": "TIA",
      "reservation": "GEN"
    },
    {
      "eci_no": 48,
      "name": "Ambur",
      "district_id": "TIA",
      "reservation": "GEN"
    },
    {
      "eci_no": 49,
      "name": "Jolarpet",
      "district_id": "TIA",
      "reservation": "GEN"
    },
    {
      "eci_no": 50,
      "name": "Tiruppattur",
      "district_id": "TIA",
      "reservation": "GEN"
    },
    {
      "eci_no": 51,
      "name": "Uthangarai",
      "district_id": "KRI",
      "reservation": "SC"
    },
    {
      "eci_no": 52,
      "name": "Bargur",
      "district_id": "KRI",
      "reservation": "GEN"
    },
    {
      "eci_no": 53,
      "name": "Krishnagiri",
      "district_id": "KRI",
      "reservation": "GEN"
    },
    {
      "eci_no": 54,
      "name": "Veppanahalli",
      "district_id": "KRI",
      "reservation": "GEN"
    },
    {
      "eci_no": 55,
      "name": "Hosur",
      "district_id": "KRI",
      "reservation": "GEN"
    },
    {
      "eci_no": 56,
      "name": "Thalli",
      "district_id": "KRI",
      "reservation": "GEN"
    },
    {
      "eci_no": 57,
      "name": "Palacode",
      "district_id": "DHA",
      "reservation": "GEN"
    },
    {
      "eci_no": 58,
      "name": "Pennagaram",
      "district_id": "DHA",
      "reservation": "GEN"
    },
    {
      "eci_no": 59,
      "name": "Dharmapuri",
      "district_id": "DHA",
      "reservation": "GEN"
    },
    {
      "eci_no": 60,
      "name": "Pappireddippatti",
      "district_id": "DHA",
      "reservation": "GEN"
    },
    {
      "eci_no": 61,
      "name": "Harur",
      "district_id": "DHA",
      "reservation": "SC"
    },
    {
      "eci_no": 62,
      "name": "Chengam",
      "district_id": "TAN",
      "reservation": "SC"
    },
    {
      "eci_no": 63,
      "name": "Tiruvannamalai",
      "district_id": "TAN",
      "reservation": "GEN"
    },
    {
      "eci_no": 64,
      "name": "Kilpennathur",
      "district_id": "TAN",
      "reservation": "GEN"
    },
    {
      "eci_no": 65,
      "name": "Kalasapakkam",
      "district_id": "TAN",
      "reservation": "GEN"
    },
    {
      "eci_no": 66,
      "name": "Polur",
      "district_id": "TAN",
      "reservation": "GEN"
    },
    {
      "eci_no": 67,
      "name": "Arani",
      "district_id": "TAN",
      "reservation": "GEN"
    },
    {
      "eci_no": 68,
      "name": "Cheyyar",
      "district_id": "TAN",
      "reservation": "GEN"
    },
    {
      "eci_no": 69,
      "name": "Vandavasi",
      "district_id": "TAN",
      "reservation": "SC"
    },
    {
      "eci_no": 70,
      "name": "Gingee",
      "district_id": "VIL",
      "reservation": "GEN"
    },
    {
      "eci_no": 71,
      "name": "Mailam",
      "district_id": "VIL",
      "reservation": "GEN"
    },
    {
      "eci_no": 72,
      "name": "Tindivanam",
      "district_id": "VIL",
      "reservation": "SC"
    },
    {
      "eci_no": 73,
      "name": "Vanur",
      "district_id": "VIL",
      "reservation": "SC"
    },
    {
      "eci_no": 74,
      "name": "Villupuram",
      "district_id": "VIL",
      "reservation": "GEN"
    },
    {
      "eci_no": 75,
      "name": "Vikravandi",
      "district_id": "VIL",
      "reservation": "GEN"
    },
    {
      "eci_no": 76,
      "name": "Tirukkoyilur",
      "district_id": "KAL",
      "reservation": "GEN"
    },
    {
      "eci_no": 77,
      "name": "Ulundurpettai",
      "district_id": "KAL",
      "reservation": "GEN"
    },
    {
      "eci_no": 78,
      "name": "Rishivandiyam",
      "district_id": "KAL",
      "reservation": "GEN"
    },
    {
      "eci_no": 79,
      "name": "Sankarapuram",
      "district_id": "KAL",
      "reservation": "GEN"
    },
    {
      "eci_no": 80,
      "name": "Kallakurichi",
      "district_id": "KAL",
      "reservation": "SC"
    },
    {
      "eci_no": 81,
      "name": "Gangavalli",
      "district_id": "SAL",
      "reservation": "SC"
    },
    {
      "eci_no": 82,
      "name": "Attur",
      "district_id": "SAL",
      "reservation": "SC"
    },
    {